{
  "container_types": [
    {
      "id": "small",
      "inner_size": { "x": 100, "y": 100, "z": 100 },
      "max_weight": 500.0,
      "quantity_limit": null
    },
    {
      "id": "large",
      "inner_size": { "x": 200, "y": 100, "z": 100 },
      "max_weight": 2000.0,
      "quantity_limit": null
    }
  ],
  "box_types": [
    {
      "id": "box_s",
      "size": { "x": 30, "y": 20, "z": 20 },
      "allowed_orientations": ["xyz", "yxz", "xzy"]
    },
    {
      "id": "box_l",
      "size": { "x": 100, "y": 100, "z": 90 },
      "allowed_orientations": ["xyz", "yxz", "xzy", "zxy", "yzx", "zyx"]
    }
  ],
  "boxes": [
    { "id": "b1", "box_type_id": "box_s", "weight": 5.0 },
    { "id": "b2", "box_type_id": "box_s", "weight": 5.0 },
    { "id": "b3", "box_type_id": "box_s", "weight": 5.0 },
    { "id": "b4", "box_type_id": "box_l", "weight": 30.0 },
    { "id": "b5", "box_type_id": "box_l", "weight": 30.0 }
  ],
  "constraints": {
    "time_limit_seconds": 30,
    "support_rate": 0.6
  }
}
